Season No;Episode No;Episode Name;Character Name;Dialogue
3;3;Pickle Rick;Pickle Rick;Oh, well, uh, she knows. I mean, we don't really buy into that kind of crap, to the extent that love is an expression of familiarity over time, my access to infinite timelines precludes the necessity of attachment. In fact, I even abandoned one of my infinite daughters in an alternate version of earth that was taken over by mutants.
3;3;Pickle Rick;Jaguar;Okay. Good luck with that. Wait. Do I have infinite daughters?
3;3;Pickle Rick;Pickle Rick;Huh? Uh, no. No, nope, sorry about that. Nope, just me. Yeesh!
3;3;Pickle Rick;Beth;I am afraid that my kids will get expelled.
3;3;Pickle Rick;Dr. Wong;Good. Summer, you go.
3;3;Pickle Rick;Summer;I am mad that I can't huff enamel without people assuming it's because my family sucks. I hope to be seen one day as someone that just likes getting high.
3;3;Pickle Rick;Dr. Wong;"Good job. Morty, do you have an I"" statement?"""
3;3;Pickle Rick;Morty;I am sad that I peed. I'm sad that I peed in class instead of a toilet.
3;3;Pickle Rick;Dr. Wong;Look at this family go. You guys are pros. What do you guys think about doing this once a week?
3;3;Pickle Rick;Pickle Rick;Ugh.
3;3;Pickle Rick;Dr. Wong;You must be Rick.
3;3;Pickle Rick;Pickle Rick;Mm-hmm.
3;3;Pickle Rick;Dr. Wong;I've heard a lot about you today. Your family is crazy about you. Your daughter holds you in very high regard. You're a lucky fella.
3;3;Pickle Rick;Pickle Rick;Yeah, thank you. Uh, sweetie, you don't still happen to have that syringe in your purse?
3;3;Pickle Rick;Beth;Dad, I would like you to tell me what's in the syringe.
3;3;Pickle Rick;Pickle Rick;It's a serum that I need to, uh, to stay alive. I have had a rough day. And, uh, I've sustained a lot of damage. I'm pretty close to death, which the serum will prevent.
3;3;Pickle Rick;Dr. Wong;By changing you from a pickle to a human.
3;3;Pickle Rick;Pickle Rick;Yes.
3;3;Pickle Rick;Dr. Wong;Rick, why did you lie to your daughter?
3;3;Pickle Rick;Pickle Rick;So I wouldn't have to come here.
3;3;Pickle Rick;Dr. Wong;Why didn't you want to come here?
3;3;Pickle Rick;Pickle Rick;Because I don't respect therapy, because I'm a scientist. Because I invent, transform, create, and destroy for a living, and when I don't like something about the world, I change it. And I don't think going to a rented office in a strip mall to listen to some agent of averageness explain which words mean which feelings has ever helped anyone do anything. I think it's helped a lot of people get comfortable and stop panicking, which is a state of mind we value in the animals we eat, but not something I want for myself. I'm not a cow. I'm a pickle. When I feel like it. So...you asked.
3;3;Pickle Rick;Dr. Wong;Rick, the only connection between your unquestionable intelligence and the sickness destroying your family is that everyone in your family, you included, use intelligence to justify sickness. You seem to alternate between viewing your own mind as an unstoppable force and as an inescapable curse. And I think it's because the only truly unapproachable concept for you is that it's your mind within your control. You chose to come here, you chose to talk -to belittle my vocation- just as you chose to become a pickle. You are the master of your universe, and yet you are dripping with rat blood and feces. Your enormous mind literally vegetating by your own hand. I have no doubt that you would be bored senseless by therapy, the same way I'm bored when I brush my teeth and wipe my ass. Because the thing about repairing, maintaining, and cleaning is it's not an adventure. There's no way to do it so wrong you might die. It's just work. And the bottom line is, some people are okay going to work, and some people well, some people would rather die. Each of us gets to choose. That's our time. I'm going to give you guys my card and hope to hear from you again. And if you have any friends or family that eat poop and would like to stop, give them my number.
3;3;Pickle Rick;Pickle Rick;I, um I'm sorry I lied to get out of the thing. I, I shouldn't lie to you.
3;3;Pickle Rick;Beth;Oh, it's fine. I mean, thank you, and, yeah, you shouldn't. But I hope you know that's not what that session was supposed to be.
3;3;Pickle Rick;Pickle Rick;Oh, no, I mean, I know it was Morty peeing his pants and Summer snorting glue or whatever...
3;3;Pickle Rick;Beth;She huffed enamel, and we never even talked about it.
3;3;Pickle Rick;Pickle Rick;Well, there was so much more at stake. I mean, that shrink, what a monologuist.
3;3;Pickle Rick;Summer;Are we gonna go back?
3;3;Pickle Rick;Pickle Rick;Sweetie, could I ge-get that syringe now?
3;3;Pickle Rick;Beth;Oh, my God, yes! Dad, it's in my purse. Oh, I'm sorry. You must be in agony.
3;3;Pickle Rick;Pickle Rick;Eh.
3;3;Pickle Rick;Rick;Jesus. Jesus Christ. Therapists, man.
3;3;Pickle Rick;Beth;Weird breed.
3;3;Pickle Rick;Rick;Man, I missed having hands and blood and a stomach. We should get a drink.
3;3;Pickle Rick;Beth;Really? Like, go somewhere?
3;3;Pickle Rick;Rick;Yeah, let's drop the kids off and go tie one on.
3;3;Pickle Rick;Beth;Absolutely!
3;3;Pickle Rick;Morty;I, I liked her.
3;3;Pickle Rick;Beth;So what are you thinking, like, Smokey's Tavern? Maybe Shoney's?
3;3;Pickle Rick;Rick;Yeah, either one. Either one.
3;3;Pickle Rick;Rick;You'll never get away with this, Concerto.
3;3;Pickle Rick;Concerto;That is where you're mistaken, Mr. Sanchez. This shall be my greatest performance of all time!
3;3;Pickle Rick;Rick;This is it, Morty. We're goners. We're not getting out of this one. After everything we've been through, this is how we're gonna die. Make peace with your god.
3;3;Pickle Rick;Morty;Oh, geez, Rick, I-I-I don't want to die!
3;3;Pickle Rick;Concerto;And now for the E-splat!
3;3;Pickle Rick;Rick;Jaguar!
3;3;Pickle Rick;Morty;Who? Who was that, Rick?
3;3;Pickle Rick;Rick;That, Morty, is why you don't go to therapy.
3;4;Vindicators 3: The Return Of Worldender;Rick;Don't let any of those things get away, Morty. If their DNA gets into Earth's food chain, our entire species could be sterilized.
3;4;Vindicators 3: The Return Of Worldender;Morty;Then why aren't we killing them?!
3;4;Vindicators 3: The Return Of Worldender;Rick;Great. Next time I need a species sterilized, who's gonna do it for me? You?
3;4;Vindicators 3: The Return Of Worldender;Morty;Oh, Rick! I-Is that the Vindibeacon? We're being called to assemble by the Vindicators!
3;4;Vindicators 3: The Return Of Worldender;Rick;I refuse to answer a literal call to adventure, Morty. Let it go to voicemail!
3;4;Vindicators 3: The Return Of Worldender;Morty;Rick, the Vindicators only call when the universe itself is at stake! They're first line of defense against evil! They're the guardians of the unguarded!
3;4;Vindicators 3: The Return Of Worldender;Rick;They're the writers of their own press releases, Morty! They're a bunch of drama queens that spend an hour talking and twenty minutes jumping around while shit blows up. They're a phase. We did one, it was the big event of that summer. Let it die.
3;4;Vindicators 3: The Return Of Worldender;Morty;I, Morty Smith, invoke my right to choose one in every ten Rick and Morty adventures.  Read 'em and weep.
3;4;Vindicators 3: The Return Of Worldender;Rick;God... fuckin' dammit!  Fine! But don't say I didn't warn you. 
3;4;Vindicators 3: The Return Of Worldender;Morty; Yes!  Vindicator command ship, beacon received! We're doing Vindicators Twoooooooooo!
3;4;Vindicators 3: The Return Of Worldender;Rick;Whoops! Uh, Morty, you might want to freeze some sperm.
3;4;Vindicators 3: The Return Of Worldender;Supernova; Vindicators, Worldender is back...
3;4;Vindicators 3: The Return Of Worldender;Supernova;..and this time, he's out to end more than worlds. We have reason to believe his stronghold is located on...
3;4;Vindicators 3: The Return Of Worldender;Rick; My balls.
3;4;Vindicators 3: The Return Of Worldender;Morty;Rick!
3;4;Vindicators 3: The Return Of Worldender;Supernova;...the Terraneus system. Once in range, Million Ants will scan for pheromone activity, which should lead us to the location of the base.
3;4;Vindicators 3: The Return Of Worldender;Rick;Oh, that's Million Ants. I can't see the ants over here. It just assumed that was, uh, Turd Man. Wiggly Turd Man.
3;4;Vindicators 3: The Return Of Worldender;Morty;Rick, stop!
3;4;Vindicators 3: The Return Of Worldender;Supernova;Rick, you have something to add to the briefing?
3;4;Vindicators 3: The Return Of Worldender;Rick;Uh, yeah, just a few more design notes.  Um, this guy. The, uh... The, uh...
3;4;Vindicators 3: The Return Of Worldender;Crocubot;I am Crocubot.
3;4;Vindicators 3: The Return Of Worldender;Rick;Right, Crocubot. So, you're half-cold, unfeeling reptile, half-also cold, equally-unfeeling machine.
3;4;Vindicators 3: The Return Of Worldender;Crocubot;Yes.
3;4;Vindicators 3: The Return Of Worldender;Rick;So, you're origin is what? Y-You fell into a vat of redundancy?
3;4;Vindicators 3: The Return Of Worldender;Noob-Noob; Got damn!
3;4;Vindicators 3: The Return Of Worldender;Supernova;Noob-Noob, we're having a briefing!  If I can continue, Rick. I anticipate sophisticated security measures. I trust you can be of service there.
3;4;Vindicators 3: The Return Of Worldender;Rick;Well, let me check my list of powers and weaknesses. Ability to do anything... But only whenever I want... Yeah, that sounds like a job for me.
3;4;Vindicators 3: The Return Of Worldender;Alan;I wish he had the ability to check is attitude.
3;4;Vindicators 3: The Return Of Worldender;Rick;Alan Rails, ladies and gentleman. After his parents' tragic death in a railroad accident, he gained the power to summon ghost trains. It's not all bad, though. They were spared having to see their grown son wear a whistle!
3;4;Vindicators 3: The Return Of Worldender;Noob-Noob;Got damn!
3;4;Vindicators 3: The Return Of Worldender;Rick;Thanks, Noob-Noob! This guy gets it.
3;4;Vindicators 3: The Return Of Worldender;Morty;Vance Maximus, Renegade Star Soldier!
3;4;Vindicators 3: The Return Of Worldender;Vance;Sorry I'm late. It was happy hour.
3;4;Vindicators 3: The Return Of Worldender;Morty; Happy hour.
3;4;Vindicators 3: The Return Of Worldender;Rick;Uh, I was also late because of my drinking and mentioned it to zero applause.
3;4;Vindicators 3: The Return Of Worldender;Vance;Rick Sanchez, Tinkerer of Terror. Man, that's hard to say. And... Morty, right?
3;4;Vindicators 3: The Return Of Worldender;Morty;Whoa, yeah!
3;4;Vindicators 3: The Return Of Worldender;Vance;I never forget a kid.  What do you say, Vindicators? Let's make this three for three?
3;4;Vindicators 3: The Return Of Worldender;Morty;"Did he say three for three""?"""
3;4;Vindicators 3: The Return Of Worldender;Rick;Did he say he never forgets a kid?
3;4;Vindicators 3: The Return Of Worldender;Morty;"You mean two for two"", right, Vance?"""
3;4;Vindicators 3: The Return Of Worldender;Supernova;Actually, we assembled a second time last summer to fight Doomnomitron.
3;4;Vindicators 3: The Return Of Worldender;Morty;So, this is... Vindicators 3? And you guys did Vindicators 2... w-without us?
3;4;Vindicators 3: The Return Of Worldender;Million Ants; I sense... insecurity.
3;4;Vindicators 3: The Return Of Worldender;Vance;Are you sure there's not just a picnic nearby.
3;4;Vindicators 3: The Return Of Worldender;Rick;I guess he found his crowd. Pretty toothless stuff, guys.
3;4;Vindicators 3: The Return Of Worldender;Rick; I hope you're happy with the adventure so far, Morty. These guys are even lamer than last time.
3;4;Vindicators 3: The Return Of Worldender;Morty;"We weren't here last time"", remember? They did a whole Vindicators without us. A bunch of them got killed, too. They lost Lady Katana, Calypso, Diablo Verde..."""
3;4;Vindicators 3: The Return Of Worldender;Rick;Yikes. Yeah, things did feel less diverse in there. 
3;4;Vindicators 3: The Return Of Worldender;Morty;"This article says the reason we weren't involved was... personality conflicts""."""
3;4;Vindicators 3: The Return Of Worldender;Rick;Don't worry, Morty, they love you. Superheroes need a wide-eyed unremarkable to tag along and react to everything like it's mind-blowing.
3;4;Vindicators 3: The Return Of Worldender;Morty;I... think the personality conflict might have been... you.
3;4;Vindicators 3: The Return Of Worldender;Rick; Jesus... How awesome is that? I mean, they wanted to not need me so bad, they murdered three innocent heroes of color, and they still had to bring me back?
3;4;Vindicators 3: The Return Of Worldender;Morty;Rick, since it's my adventure and all, could you do me a favor?
3;4;Vindicators 3: The Return Of Worldender;Rick;Uh, the adventure is the favor, Morty. Me sleeping on these linens is the favor. I mean, w-w-w-what--what are we vindicating? Comfort?
3;4;Vindicators 3: The Return Of Worldender;Morty;Rick, this really bums me out. It-It's embarrassing to find out these guys don't like us.
3;4;Vindicators 3: The Return Of Worldender;Rick;Why? Morty,  I defeat gagoos more powerful than these guys every week.
3;4;Vindicators 3: The Return Of Worldender;Morty;Yeah, but not heroes.
3;4;Vindicators 3: The Return Of Worldender;Rick;Oh, please. They just call themselves heroes so they can...
3;4;Vindicators 3: The Return Of Worldender;Morty;I'm calling them that, Rick! They're my heroes! Mine! 
3;4;Vindicators 3: The Return Of Worldender;Rick;Huh... no accounting for taste. I'm gonna go get a drink.
3;4;Vindicators 3: The Return Of Worldender;PA System;Good morning, Vindicators. Ship has arrived at Terraneus system. All Vindicators report to the... briefing room. The--The room from the, uh... the... Uh, it's the d--It's a different room than--than... conference room. I'm sorry, it's my first day as a PA system. First day jitters. 
3;4;Vindicators 3: The Return Of Worldender;Morty; Oh, God.
3;4;Vindicators 3: The Return Of Worldender;Supernova;Good morning. Looks like your grandpa had a long night. Crocubot, why don't you escort Mr. Sanchez to a more comfortable spot so that someone can...  clean up his diarrhea.
3;4;Vindicators 3: The Return Of Worldender;Noob-Noob;Whoa, I'm nervous about my first mission.
3;4;Vindicators 3: The Return Of Worldender;Supernova;Actually, Noob-Noob, you have a new mission. 
3;4;Vindicators 3: The Return Of Worldender;Noob-Noob; Got... damn.
3;4;Vindicators 3: The Return Of Worldender;Supernova;Vindicators, prepare for arrival.
3;4;Vindicators 3: The Return Of Worldender;Vance;Morty, the Vindicators and I had a chat this morning and I'm afraid we need to make a little change.
3;4;Vindicators 3: The Return Of Worldender;Morty; I-I totally get it. I-I'm so sorry.
3;4;Vindicators 3: The Return Of Worldender;Vance;You should be.  Running around in a yellow t-shirt like you're not one of us? Disgraceful.
3;4;Vindicators 3: The Return Of Worldender;Morty; I-I-I... I'm not a superhero.
3;4;Vindicators 3: The Return Of Worldender;Vance;Cop a squat, chief.  Everyone in the universe is a hero. All you have to do is know the difference between good and bad, and root for good.
3;4;Vindicators 3: The Return Of Worldender;Morty;"Rick says good"" and ""bad"" are artificial constructs."""
3;4;Vindicators 3: The Return Of Worldender;Vance;Yeah, well, I get the feeling... he kind of needs that to be the case.  Not coming, Noob-Noob?
3;4;Vindicators 3: The Return Of Worldender;Noob-Noob; Ohh! No, uh, I... I got stuff to do here.
3;4;Vindicators 3: The Return Of Worldender;Vance;Security drones, inbound.
3;4;Vindicators 3: The Return Of Worldender;Supernova;Star Mother, grant me your wrath! 
3;4;Vindicators 3: The Return Of Worldender;Alan;All aboard!
3;4;Vindicators 3: The Return Of Worldender;Million Ants;Aah!  Gun turret.
3;4;Vindicators 3: The Return Of Worldender;Supernova;Are you all right?
3;4;Vindicators 3: The Return Of Worldender;Million Ants;Yes. I only lost 400 ants. My queen is laying more.  I am back to one million ants.
3;4;Vindicators 3: The Return Of Worldender;Supernova;Someone wake up Sanchez.
3;4;Vindicators 3: The Return Of Worldender;Rick;Ugh! Oh, Christ...
3;4;Vindicators 3: The Return Of Worldender;Supernova;Rick, you're up.
3;4;Vindicators 3: The Return Of Worldender;Rick;Barely.
3;4;Vindicators 3: The Return Of Worldender;Supernova;Rick, we're taking fire from an automated turret. Can you bring it offline?
3;4;Vindicators 3: The Return Of Worldender;Rick;Uh-huh.
3;4;Vindicators 3: The Return Of Worldender;Rick;Uh, my God, that's better.
3;4;Vindicators 3: The Return Of Worldender;Supernova;RICK!
3;4;Vindicators 3: The Return Of Worldender;Rick;Hey, I can't help if I can't see.
3;4;Vindicators 3: The Return Of Worldender;Alan;I could've just used a ghost train.
3;4;Vindicators 3: The Return Of Worldender;Rick;Really? You don't say. You would have used a ghost train?  Hey, everybody, the ghost train guy would have used a ghost train!
3;4;Vindicators 3: The Return Of Worldender;Alan;Man, fuck you.
3;4;Vindicators 3: The Return Of Worldender;Rick;Is there coffee? Hey, Morty, can you be a pal? Grandpa left his coffee maker on the ship. Y-You know, the French press thing?
3;4;Vindicators 3: The Return Of Worldender;Morty; Get it yourself.
3;4;Vindicators 3: The Return Of Worldender;Rick;Little extra  snippy this morning, aren't you?
3;4;Vindicators 3: The Return Of Worldender;Morty;Just focus on the mission, all right?
3;4;Vindicators 3: The Return Of Worldender;Rick; Oh, oh, oh, I'm sorry. Oh, you're right. Ooh, real serious. Gotta take it real serious, huh? 
3;4;Vindicators 3: The Return Of Worldender;Alan; Son of a steam engine! They're all dead!
3;4;Vindicators 3: The Return Of Worldender;Crocubot;Why would Worldender do this to his own men... and several women?
3;4;Vindicators 3: The Return Of Worldender;Vance;Well, he is the Worldender. The guy ends worlds. Kind of his thing.
3;4;Vindicators 3: The Return Of Worldender;Rick; Ooh, real scared. Real fucking on alert, high alert over here.
3;4;Vindicators 3: The Return Of Worldender;Vance;What the FUCK?!
3;4;Vindicators 3: The Return Of Worldender;Supernova;It's Worldender! What happened to him?
3;4;Vindicators 3: The Return Of Worldender;Million Ants;I sense his life force is fading.
3;4;Vindicators 3: The Return Of Worldender;Rick;Million Ants, ladies and gentleman! The ant colony with the power of two human eyes!
3;4;Vindicators 3: The Return Of Worldender;Rick;All right. Short mission, good mission. Remember when Alan wanted to use a ghost train? See you guys in Vindicators 4. Morty?
3;4;Vindicators 3: The Return Of Worldender;Morty;Rick, whoever did this is an even bigger threat than Worldender! We can't leave now!
3;4;Vindicators 3: The Return Of Worldender;Supernova;He's right. This is far from over.
3;4;Vindicators 3: The Return Of Worldender;Rick;Well, have fun with that. But Morty and I have to meet a comet girl, a monorail man, two assholes and a full alligator in, like, an hour.
3;4;Vindicators 3: The Return Of Worldender;Rick;Shit.
3;4;Vindicators 3: The Return Of Worldender;Million Ants;I sense the presence of a greater evil.
3;4;Vindicators 3: The Return Of Worldender;Drunk Rick;Check, check, One, two. Okay, is it recording? Good. Hello, Vindicators. Welcome to your reckoning, babyyyyyyyy!!
3;4;Vindicators 3: The Return Of Worldender;Rick;Welp, it's official. I had too much to drink last night.
3;4;Vindicators 3: The Return Of Worldender;Drunk Rick; If you guys are watching this, you're, you know, the Vindicators. So now that we know...
3;4;Vindicators 3: The Return Of Worldender;Vance; Rick? What's going on, buddy?
3;4;Vindicators 3: The Return Of Worldender;Rick;Obviously, I came here last night during a blackout.
3;4;Vindicators 3: The Return Of Worldender;Supernova;Obviously? You came here and defeated our arch-nemesis while so drunk, you don't remember doing it? That's something obvious to you?
3;4;Vindicators 3: The Return Of Worldender;Rick;Look, I'm a lit-- little more complex than you guys and, no offense, but I've always suspected that a lot of what you do in a year could be knocked out in a couple of hours.
3;4;Vindicators 3: The Return Of Worldender;Drunk Rick;...So I thought, why not just do your job for you so we can have a little fun game. 
3;4;Vindicators 3: The Return Of Worldender;Morty;"Rick, is-is this a Saw"" thing? Are you seriously ""Saw""-ing the Vindicators?"""
3;4;Vindicators 3: The Return Of Worldender;Rick;Morty I'm a drunk, not a hack.
3;4;Vindicators 3: The Return Of Worldender;Drunk Rick;"If you break the rules, lose the game or try to leave, you will die. Like in  Sawwww""."""
3;4;Vindicators 3: The Return Of Worldender;Rick; Well, I-I-I think we've seen enough. I'll just figure out how to unplug this. 
3;4;Vindicators 3: The Return Of Worldender;Drunk Rick;Okay, here we go, room number one. The Vindicators are known throughout the galaxy, but do they know yourselves? Do you know yourselves? Match your... your shit, your... your gimmicks with your faces and y-you get it, it's a matching thing. And do it in three minutes, or you'll  all die.
3;4;Vindicators 3: The Return Of Worldender;Vance;Screw this. I'm not playing his game. I'm gonna find us a way out of here.
3;4;Vindicators 3: The Return Of Worldender;Rick;Whoa, whoa, whoa. Hold on, Vance. He said you'd die if you tried to leave. That means there's booby traps.
3;4;Vindicators 3: The Return Of Worldender;Vance;Why are you acting like that's not you?!
3;4;Vindicators 3: The Return Of Worldender;Rick;"What part of blackout"" don't you understand? I thought you drank?"""
3;4;Vindicators 3: The Return Of Worldender;Vance;Like cool drinking! Like sexy drinking, not this psycho trailer-park shit!
3;4;Vindicators 3: The Return Of Worldender;Morty;Vance, stay calm...
3;4;Vindicators 3: The Return Of Worldender;Vance;Oh, so you're the leader now because we gave you a jacket?! You're the learning-disabled kid we do photo-ops with!
3;4;Vindicators 3: The Return Of Worldender;Morty;Okay, ouch, but...
3;4;Vindicators 3: The Return Of Worldender;Vance; Okay, this... this is triggering me. I need space. I-I need SPACE! FROM THIS!
3;4;Vindicators 3: The Return Of Worldender;Alan;Give me one good reason why I shouldn't crush your windpipe!
3;4;Vindicators 3: The Return Of Worldender;Rick;Because my epidermis is laced with a nanofiber defense mesh.
3;4;Vindicators 3: The Return Of Worldender;Rick;And because, like I said, I don't remember last night.
3;4;Vindicators 3: The Return Of Worldender;Alan;I told you not to invite this mummified motherfucker back!
3;4;Vindicators 3: The Return Of Worldender;Rick;Alan, I'm not proud of what's happening here, but if you keep coming at me, there's gonna be another passenger on that ghost train.
3;4;Vindicators 3: The Return Of Worldender;Morty;Guys!  I've figured it out.
3;4;Vindicators 3: The Return Of Worldender;Drunk Rick;Congrats! You did it-- it!
3;4;Vindicators 3: The Return Of Worldender;Morty;It was a bit. All of the descriptors apply to all of you. Drunk Rick's point is that none of you are very special or different.  That's always his point.
3;4;Vindicators 3: The Return Of Worldender;Supernova;Let's just get through this as quickly as possible. Then, we'll deal with the two of you.
3;4;Vindicators 3: The Return Of Worldender;Morty;The two of us?!  I hope you're proud of yourself!
3;4;Vindicators 3: The Return Of Worldender;Rick;Uh, I kind of am. I saved the goddamn universe.
3;4;Vindicators 3: The Return Of Worldender;Morty;That's not the issue, Rick!
3;4;Vindicators 3: The Return Of Worldender;Rick;Ahh, it would've been if I hadn't.
3;4;Vindicators 3: The Return Of Worldender;Drunk Rick;The Vindicators say their job is... is to fight evil wherever it hides, but they don't... pick the location you'll... you'll never even hear them mention, because to fight darkness is to fight yourself.
3;4;Vindicators 3: The Return Of Worldender;Crocubot;Oh, I know this! Dorian 5! 
3;4;Vindicators 3: The Return Of Worldender;Supernova;Crocubot, don't!
3;4;Vindicators 3: The Return Of Worldender;Crocubot; There's no other possible answer. My mechanical and reptilian logic are certain of it.
3;4;Vindicators 3: The Return Of Worldender;Rick;Huh, I'm seeing more croc than bot here.
3;4;Vindicators 3: The Return Of Worldender;Supernova;Goddammit!
3;4;Vindicators 3: The Return Of Worldender;Morty;Uh, what happened on Dorian 5?
3;4;Vindicators 3: The Return Of Worldender;Supernova;Nothing!
3;4;Vindicators 3: The Return Of Worldender;Alan;Nothing?! We exterminated a planet!
3;4;Vindicators 3: The Return Of Worldender;Morty;W-Wait, huh?
3;4;Vindicators 3: The Return Of Worldender;Supernova;Doomnomitron was hiding there! He's a shapeshifter! Destroying Dorian 5 was the only way to kill him!
3;4;Vindicators 3: The Return Of Worldender;Drunk Rick;Come on, guys, we're all thinking it. Don't...  Don't make me say it.
3;4;Vindicators 3: The Return Of Worldender;Morty; Oh, o-okay. This again? 
3;4;Vindicators 3: The Return Of Worldender;Rick;You know,  I could have made a device to detect Doomnomitron from orbit like  that.
3;4;Vindicators 3: The Return Of Worldender;Supernova;I'm not the one that didn't want you back. Alan was!
3;4;Vindicators 3: The Return Of Worldender;Alan; If you lay those deaths at my doorstep one more time...
3;4;Vindicators 3: The Return Of Worldender;Million Ants; Do not threaten her!
3;4;Vindicators 3: The Return Of Worldender;Drunk Rick;Congrats, you did it!
3;4;Vindicators 3: The Return Of Worldender;Supernova;What the hell is Is-ra-el?
3;4;Vindicators 3: The Return Of Worldender;Morty;I-It's just something Rick starts talking about whenever he's blackout drunk.
3;4;Vindicators 3: The Return Of Worldender;Rick;W-What? In w--In w-w-what--In what way? Like, w-w-what's my point?
