Season No;Episode No;Episode Name;Character Name;Dialogue
3;7;Tales From The Citadel;Good-Looking Rick; Yes, it's great!
3;7;Tales From The Citadel;President Morty;Good.
3;7;Tales From The Citadel;President Morty;This seems like a good time for a drink, and a cold, calculated speech with sinister overtones. A speech about politics, about order, brotherhood, power...
3;7;Tales From The Citadel;President Morty;But speeches are for campaigning.  Now... is the time for action.
3;7;Tales From The Citadel;Rick;Whoa!! Hahaha, yeah! Atlantis, baby!
3;7;Tales From The Citadel;Morty;That was amazing! 
3;7;Tales From The Citadel;Rick;Got some of that mermaid puss!
3;7;Tales From The Citadel;Morty;I'm really hoping it wasn't a one-off thing and I can see her again. By the way, hey, um... still not curious about what might've happened at that crazy Citadel place?
3;7;Tales From The Citadel;Rick; Pssh! Not at all, Morty. That place will never have any bearing over our lives ever again. Unlike that mermaid puss! Yeah!! We're going back for seconds! We're gonna do that shit every week, man! That was Atlantis!
3;7;Tales From The Citadel;Morty; Whoo! Yeah! Yeaah! Ohhh, shit!
3;8;Morty's Mind Blowers;Rick;Morty, hurry!
3;8;Morty's Mind Blowers;Morty;Return the Truth Tortoise!
3;8;Morty's Mind Blowers;Rick;Morty, whatever you do, dont drop the Truth Tortoise! Also really important, whatever you do, dont look into its eyes!
3;8;Morty's Mind Blowers;Morty;I I did look at it, Rick! Ive been looking at it!
3;8;Morty's Mind Blowers;Rick;Now youre gonna know everything, Morty! Good job! Way to go! You  everything up!
3;8;Morty's Mind Blowers;Morty;Its in my head! Ah! Oh, geez, I I cant get that Truth Tortoise out of my head.
3;8;Morty's Mind Blowers;Rick;Yeah, I told you not to look into its eyes. Hey, Morty, lets watch some interdimensional cable. Remember how we used to do that?
3;8;Morty's Mind Blowers;Morty;Rick, I cant I cant go on. I-I cant go on like this with the Truth Tortoise shit in my head. I-I wish you could just
3;8;Morty's Mind Blowers;Rick;Erase the memory from your mind?
3;8;Morty's Mind Blowers;Morty;How did you know I was gonna say that?
3;8;Morty's Mind Blowers;Rick;Come on, Morty, come with me.
3;8;Morty's Mind Blowers;Rick;After you.
3;8;Morty's Mind Blowers;Morty;What the hell is this?!
3;8;Morty's Mind Blowers;Rick;This, Morty, is my archive of all the experiences youve begged me to remove from your life, lest you go insane. I call them Mortys Mind Blowers. And well be doing this instead of interdimensional cable.
3;8;Morty's Mind Blowers;Morty;How long have I been asking you to remove memories?
3;8;Morty's Mind Blowers;Rick;Since the first time your mind was blown. Ahh, here it is. Classic. Theres no dust on it because this isnt the first time weve done this.
3;8;Morty's Mind Blowers;Morty;- What?! -
3;8;Morty's Mind Blowers;Rick;"I call this one Moonspiracy""!"""
3;8;Morty's Mind Blowers;Morty;Huh, wow. Thats incredible. What the heck?
3;8;Morty's Mind Blowers;Beth;Morty, do you realize how ridiculous that sounds?
3;8;Morty's Mind Blowers;Rick;Yeah, pretty crazy story, Morty.
3;8;Morty's Mind Blowers;Morty;Are you serious? Half the crap weve seen, and you think that sounds crazy?
3;8;Morty's Mind Blowers;Rick;"Ive been to 300 versions of Earths moon, including this one, and Ive never seen signs of a regular dude,"" as you describe him, hanging out up there."""
3;8;Morty's Mind Blowers;Summer;Its probably just a smudge on the lens.
3;8;Morty's Mind Blowers;Morty;Smudge on the lens? Smudge on the lens?! I know the difference between a man threatening me and a smudge on the goddamn lens, Summer!
3;8;Morty's Mind Blowers;Beth;Morty, calm down! Are you feeling okay?
3;8;Morty's Mind Blowers;Morty;Im fine!
3;8;Morty's Mind Blowers;Summer;So sensitive.
3;8;Morty's Mind Blowers;Principal;Kids, Id like to introduce you all to our new guidance counselor, Mr. Lunas.
3;8;Morty's Mind Blowers;Mr. Lunas;I look forward to helping guide you all towards a brighter future. I believe every student should shoot for the moon.
3;8;Morty's Mind Blowers;Morty;Got you now, you son of a bitch.
3;8;Morty's Mind Blowers;Principal;Whats this?
3;8;Morty's Mind Blowers;Morty;Proof that Mr. Lunas isnt who he says he is! Hes not a guidance counselor? I I assume hes qualified to be one, who isnt? But he also lives on the moon.
3;8;Morty's Mind Blowers;Principal;Okay. Hmm. Is that it? Is he doing anything to hurt anyone?
3;8;Morty's Mind Blowers;Morty;Oh, hes up to something.
3;8;Morty's Mind Blowers;Principal;"I think I understand. Up to something,"" ""lives on the moon. "" Okay, Ill talk to him."""
3;8;Morty's Mind Blowers;Morty;What did he say?
3;8;Morty's Mind Blowers;Principal;Denied the moon stuff, but thats what pedophiles do, they deny, its their bread and butter.
3;8;Morty's Mind Blowers;Morty;Pedophile?
3;8;Morty's Mind Blowers;Principal;You dont think so? I thought the moon thing might have been code.
3;8;Morty's Mind Blowers;Morty;No, hes literally from the moon!
3;8;Morty's Mind Blowers;Principal;Well, you saw him react. Moon or not, that dude likes em young.
3;8;Morty's Mind Blowers;Marine;Gordon Lunas was a good Marine. We dont know what drove him to take his own life, but we want to remember the good things. Like how, from a certain angle, some people would say he looked like a smudge.
3;8;Morty's Mind Blowers;Morty;Oh, my God, what have I done? What have I done? Jesus, I made that guy kill himself!
3;8;Morty's Mind Blowers;Rick;"Only in a literal sense. Heres one I call Mortys Menagerie. "" They dont all have titles, though. Its not a ""Simpsons"" Halloween special, more like a clip show made of clips you never saw! I cant believe we got put into a menagerie."""
3;8;Morty's Mind Blowers;Morty;So this guy collects living beings?
3;8;Morty's Mind Blowers;Rick;"Yeah, you know like commemorative plates, but less off-putting. Youll get it when youre still actively dating in your 40s. Assess this with cold indifference, you beany-headed prick! Hey, keep it down! Just our luck, menagerie beneath the boulder people"" of Granitor Seven."""
3;8;Morty's Mind Blowers;Morty;I cant take it anymore, Rick!
3;8;Morty's Mind Blowers;Rick;Relax, Morty!
3;8;Morty's Mind Blowers;Morty;I cant relax! R-R-Rick, we We gotta get outta here! I dont care what it takes! Anything! -
3;8;Morty's Mind Blowers;Rick;Anything? -
3;8;Morty's Mind Blowers;Morty;Anything!
3;8;Morty's Mind Blowers;Rick;All right, well, youre gonna have to take off your shirt. Not yet. Ill tell you when.
3;8;Morty's Mind Blowers;Lady Scientist;Dear God.
3;8;Morty's Mind Blowers;Dude Scientist;What?
3;8;Morty's Mind Blowers;Lady Scientist;The signal turned out to be Theres no other way to put it Instructions.
3;8;Morty's Mind Blowers;Official;For?
3;8;Morty's Mind Blowers;Lady Scientist;A vehicle, sir, an interstellar vehicle.
3;8;Morty's Mind Blowers;Official;Well need a pilot. I wonder if theres a volunteer. Mm.
3;8;Morty's Mind Blowers;Lady Scientist;"Oh, the schematics specify a second, smaller pilot. I mean, they really specify smaller. They have to be exactly 53."""
3;8;Morty's Mind Blowers;Official;Chang, you may have majored in Liberal Arts, but I think youre about to make history.
3;8;Morty's Mind Blowers;Lady Scientist;Primary systems, check. Auxiliary systems, check. See you soon.
3;8;Morty's Mind Blowers;Rick;Okay, now.
3;8;Morty's Mind Blowers;Rick;Greetings. 
3;8;Morty's Mind Blowers;Lady Scientist;Youre... You look...
3;8;Morty's Mind Blowers;Rick;Weve possessed forms your mind can accept. Here are some customary clothing gifts. Please, put them on. 
3;8;Morty's Mind Blowers;Lady Scientist;May we? 
3;8;Morty's Mind Blowers;Rick;Of course, yes. 
3;8;Morty's Mind Blowers;Lady Scientist;We followed your instructions. We have so much to learn from you. 
3;8;Morty's Mind Blowers;Rick;I know, right?
3;8;Morty's Mind Blowers;Morty;Hey, how come I was able to see those other peoples memories? I I wouldnt have been around for that.
3;8;Morty's Mind Blowers;Rick;"Yeah, sometimes I gotta do a little editing, Morty. It helps the mind blowers play a little bit better upon revisiting. I call this one The Whole Enchilada. "" Here, Morty, thisll make your urine drinkable."""
3;8;Morty's Mind Blowers;Morty;Now can we keep shopping?
3;8;Morty's Mind Blowers;Zikzak;I am Zikzak.
3;8;Morty's Mind Blowers;Rick;Ah, shit, Morty, get behind me. Its a  alien overlord! Its okay. Here. Oh, I misjudged.
3;8;Morty's Mind Blowers;Morty;"I am Floop Floopian. Please kill me."""""
3;8;Morty's Mind Blowers;Rick;Thats right, Morty. The Floop Floopians achieve an eternal orgasmic afterlife, so long as theyre killed by a great warrior. Im flattered, by the way. Thank you very much.
3;8;Morty's Mind Blowers;Morty;So youre gonna kill him?
3;8;Morty's Mind Blowers;Rick;Eh, lets get some lunch first. So, you want to get shot in the head, or
3;8;Morty's Mind Blowers;Zikzak;Well, as long as the wound is fatal, I dont really mind where you shoot me.
3;8;Morty's Mind Blowers;Rick;Cool. Im gonna go take a quick shit.
3;8;Morty's Mind Blowers;Morty;Well, I gotta say. You know, Im a little envious. Your species has an actual afterlife. Thats gotta be nice.
3;8;Morty's Mind Blowers;Zikzak;Wh-What do you mean?
3;8;Morty's Mind Blowers;Morty;Well, you know, here on Earth, w-we dont know whats going on. It must be nice for you guys to, you know, have that Have that proofs in the pudding, you know, evidence.
3;8;Morty's Mind Blowers;Zikzak;Evidence? Theres supposed to be evidence?
3;8;Morty's Mind Blowers;Rick;Um, yeah, uh otherwise, how do you know if its true? Wait, you dont
3;8;Morty's Mind Blowers;Rick;All right, so you want to do this here or outside?
3;8;Morty's Mind Blowers;Morty;Run!
3;8;Morty's Mind Blowers;Zikzak;I dont wanna die! Oh, God, its all real! Oh, it hurts! Oh, I shouldnt have doubted it! I shouldnt have let you make me doubt it! Aah! I blame you, I blame you!
3;8;Morty's Mind Blowers;Morty;But he said there wasnt any evidence!
3;8;Morty's Mind Blowers;Rick;That was a ton of evidence! Well, silver lining. Now I know their religions real. They have a hell, and it does not look good. I noticed you never finished your chimichanga, so I got some room for it now, if you know what I mean.
3;8;Morty's Mind Blowers;Morty;Holy ! How many of these are just horrible mistakes Ive made? I mean, maybe Id stop making so many if I let myself learn from them!
3;8;Morty's Mind Blowers;Rick;Dont break your back creating a lesson, Morty. Its a freeform anthology. Im getting annoyed youre not hearing that. As you can see around me, your minds been blown countless times, and not always by yourself.
3;8;Morty's Mind Blowers;Morty;Ah, , I dont even
3;8;Morty's Mind Blowers;Rick;"This better not have been a good one. What is this? Great, Booger AIDS,"" ""AIDS Booger."" I gotta start using real file names.In the meantime, enjoy a grab bag of mind blowers I call ""Poop AIDS underscore copy."""""
3;8;Morty's Mind Blowers;Alien King;Im not an unreasonable man, Beth Smith. I know children are everything to a mammal. I will spare one of their lives. You simply have to choose.
3;8;Morty's Mind Blowers;Beth;Summer! Summer.
3;8;Morty's Mind Blowers;Rick;Youre not gonna believe this. I went to Phoebe instead of Titan. Its, like, hello, Saturn, after ten moons, time to stop naming and start numbering, you know? Whats Wh-Whats with you assholes?
3;8;Morty's Mind Blowers;Beth;Morty, please, dont do this.
3;8;Morty's Mind Blowers;Morty;Your Morty is gone! I am Voltamatron, Destroyer of Worlds!
3;8;Morty's Mind Blowers;Summer;Grandpa Rick, there must be some scientific way to save him!
3;8;Morty's Mind Blowers;Rick;Not scientific, but there may be a way. Morty, I know youre in there. Its me, your grandpa. I know I can be mean, but I love you, Morty. We all do, you gotta fight this thing. I know you can. Youre stronger than all of us!
3;8;Morty's Mind Blowers;Beth;Morty, its mom! We love you, you have to fight it!
3;8;Morty's Mind Blowers;Summer;Come on, Morty! Fight that stupid worm thing! We love you! We love you so much! Yes, Morty, come on, youre doing it! Youre doing it! Youre doing it! Should we pull it out?
3;8;Morty's Mind Blowers;Rick;No, dont touch it. Just keep loving Morty!
3;8;Morty's Mind Blowers;Beth;We still love you. But I do have a thing at 6:00.
3;8;Morty's Mind Blowers;Summer;Oh, God, do I have to keep looking?
3;8;Morty's Mind Blowers;Rick;Geez, Morty, come on, pinch it off already! Dont! Oh, God, sorry, Morty, I love you! God, is there going to be an intermission? Excuse me, but I ordered the large evil space worm.I know, its like, is that a demon slug in your stomach, or are you just happy to Sorry!
3;8;Morty's Mind Blowers;Morty;Well, I guess its nice to know the whole family sucks! So if the blues ones are my fault, and the purple ones are my familys, what are the red ones?
3;8;Morty's Mind Blowers;Rick;Yeah, d-dont read into it, Morty!
3;8;Morty's Mind Blowers;Morty;Ahh.
3;8;Morty's Mind Blowers;Rick; We need to find shelter before the sunset, Morty. Venzenulon Nine has a night temperature of 300 below! Well freeze, Morty! W-Well be dead in seconds!
3;8;Morty's Mind Blowers;Morty;I I think I saw a cave over there.
3;8;Morty's Mind Blowers;Rick;Youve seen too many movies, Morty. A cave isnt gonna cut it. Were gonna have to use Beebo.
3;8;Morty's Mind Blowers;Morty;Beebo led us to water! Hes our friend! -
3;8;Morty's Mind Blowers;Rick;He wont even feel it! -
3;8;Morty's Mind Blowers;Morty;Oh, no, no!
3;8;Morty's Mind Blowers;Rick;You wanna die, Morty? Get in Beebo! Oh, no, no! Brace for the ice limit. Here it comes! Wait, are we on Venzenulon Nine or Venzenulon Seven?
3;8;Morty's Mind Blowers;Morty;Wait a minute, why would I ask for that to be removed? Are the red ones stuff you wanted removed?
3;8;Morty's Mind Blowers;Rick;Ooh, thats clever, Morty, but I dont use color to sort things because Im not a mouse in a European childrens book.
3;8;Morty's Mind Blowers;Morty;Then why are all those pink ones by the liquor?
3;8;Morty's Mind Blowers;Rick;Liquor? , that was close.
3;8;Morty's Mind Blowers;Morty;We lost Captain Sky. He gave his life for the uprising.
3;8;Morty's Mind Blowers;Rick;Yeah. It really makes you think, huh, Morty? We should never take things for granite.
3;8;Morty's Mind Blowers;Morty;- What? -
3;8;Morty's Mind Blowers;Rick;Im just saying, lifes short. We shouldnt take things for granite.
3;8;Morty's Mind Blowers;Morty;"- Are you saying granite""? -"""
3;8;Morty's Mind Blowers;Rick;Well, yeah.
3;8;Morty's Mind Blowers;Morty;"Its granted,"" with a ""D."" Take things for granted. Did you actually think it was Jesus Christ, Rick, what are you, a boulder A rock person? How long have you been saying that wrong?"""
3;8;Morty's Mind Blowers;Rick;Oh, you like that, huh? I b-b-bet that really blows your mind.
3;8;Morty's Mind Blowers;Morty;I mean, yeah, its kind of great.
3;8;Morty's Mind Blowers;Rick;- You want me to erase it? -
3;8;Morty's Mind Blowers;Morty;What, you can do that?
3;8;Morty's Mind Blowers;Rick;Ah, .
3;8;Morty's Mind Blowers;Morty;I  knew it, you piece of ! You You Youre a  asshole, Rick!
3;8;Morty's Mind Blowers;Rick;Take it easy, Morty, come on. Just relax.
3;8;Morty's Mind Blowers;Morty;No, Im not gonna  relax! Come here!
3;8;Morty's Mind Blowers;Rick;Let go of me, you little bitch!
3;8;Morty's Mind Blowers;Morty;Im gonna grab you by the scruff of your
3;8;Morty's Mind Blowers;Rick;Take that!
3;8;Morty's Mind Blowers;Morty;Ohh! -
3;8;Morty's Mind Blowers;Rick;Umm.
3;8;Morty's Mind Blowers;Morty;- Umm. Uhh.- What -
3;8;Morty's Mind Blowers;Rick;Whats going on? -
3;8;Morty's Mind Blowers;Morty;Where am I? -
3;8;Morty's Mind Blowers;Rick;Who are we?
3;8;Morty's Mind Blowers;Morty;Who am I? I think Im an adolescent boy.
3;8;Morty's Mind Blowers;Rick;Huh, and Im an elderly man. And we appear to be in some kind of secret confined space.Yeah, umm Dont look at me like that. For all we know, you could be the  weirdo. Huh, these things are obviously storage units, and since we cant remember what went wrong, my guess is that the technology involves memory, and that this thing on your head is designed to Tell us the code, jagoff! Its pointless. Hes stonewalling.
3;8;Morty's Mind Blowers;Morty;Rick, if we dont unlock those vaccines, Earth dies! You know, it might be time to step up your interrogation!
3;8;Morty's Mind Blowers;Rick;Not sure what youre implying, Morty, but some lines I dont cross.
3;8;Morty's Mind Blowers;Morty;Yeah, well, I crossed every line I had when this bastard tried to kill Jessica!
3;8;Morty's Mind Blowers;Rick;Okay, see those two fleshy sacs under his chin, Morty? Grab em. You remember the codes now? Twist! Give us the codes, man! Twist harder, Morty! Harder! Okay, let go, let go, let him breathe. He wants to make a deal. Half the codes now, half after you finish.
3;8;Morty's Mind Blowers;Morty;But can we trust Wait, what? F-Finish what?
3;8;Morty's Mind Blowers;Rick;Y-You know
3;8;Morty's Mind Blowers;Morty;I thought I was torturing him!
3;8;Morty's Mind Blowers;Rick;Oh, and this disappoints you? Do I tell him we dont have a deal, Morty? Because if we can kill our enemies, but we cant jack them off, then how are we better than them?
3;8;Morty's Mind Blowers;Morty;"Well, what did you find out? Were partners, I guess, and we fight aliens, like ""Men in Black""?"
3;8;Morty's Mind Blowers;Rick;"Men in Black, Men in Black. I have ""Men in Black 2"" in here."
3;8;Morty's Mind Blowers;Morty;So So you get the general idea.
3;8;Morty's Mind Blowers;Rick;Not quite. Its basically an endless string of callbacks to
3;8;Morty's Mind Blowers;Morty;All right, save it for Youtube.Ill keep looking for clues.
3;8;Morty's Mind Blowers;Rick;What are you doing?
3;8;Morty's Mind Blowers;Morty;You want your shelf level or not?
3;8;Morty's Mind Blowers;Rick;And if I say yes, youre gonna provide that for me with that?
3;8;Morty's Mind Blowers;Morty;Yes, see the bubble?
3;8;Morty's Mind Blowers;Rick;Im familiar with the bubble, Morty. I also dabble in precision, and if you think you can even approach it with your sad, naked, caveman eyeball and a bubble of  air, youre the reason this species is a failure, and it makes me angry!
3;8;Morty's Mind Blowers;Morty;Youre drunk.
3;8;Morty's Mind Blowers;Rick;You want to put up a shelf, put up a shelf You want to experience true level? Do you?
3;8;Morty's Mind Blowers;Morty;Y-yes.
3;8;Morty's Mind Blowers;Rick;Ugh, all right, come on.
3;8;Morty's Mind Blowers;Morty;Wow, its so Oh, oh, oh, oh, my God, oh, Christ, ooh, ooh, ooh, ahh.
3;8;Morty's Mind Blowers;Rick;Oh, yeah, true level, bitch.
3;8;Morty's Mind Blowers;Summer;Morty, come on, were leaving for school.
3;8;Morty's Mind Blowers;Morty;Oh, everythings crooked! Reality is poison! I want to go back! I hate this!
3;8;Morty's Mind Blowers;Summer;Whats his deal?
3;8;Morty's Mind Blowers;Morty;Cant live like this! Shh, shh, shh, shh, Morty, Morty, Morty.
3;8;Morty's Mind Blowers;Rick;Go to school, Summer. Ill go in Mortys memory and do a little Lambs to the cosmic slaughter!
3;8;Morty's Mind Blowers;Morty;Well? You seem to be in charge of what I get to remember. Why?
3;8;Morty's Mind Blowers;Rick;Good question. Morty, I need darkness to prime these optical inductors. Hit the leftmost light switch by the door for me. The left. Okay, lights on. So, did I just hear three distinct light switch clicks?
3;8;Morty's Mind Blowers;Morty;W-W-What do you mean?
3;8;Morty's Mind Blowers;Rick;I feel like the three sounds I heard could be explained by an initial erroneous flipping of a switch on the right followed by a hasty, corrective flipping of the requested switch. Then during the resultant darkness and silence, a third, shameful unflipping of the initially flipped switch. Is my assessment accurate?
3;8;Morty's Mind Blowers;Morty;Yeah, thats thats basically how how it all shaked out. Im sorry.
3;8;Morty's Mind Blowers;Rick;Ugh. All right, come on.
3;8;Morty's Mind Blowers;Morty;What?!
3;8;Morty's Mind Blowers;Rick;Come on! Grab a shovel.
3;8;Morty's Mind Blowers;Morty;W-What is
3;8;Morty's Mind Blowers;Rick;Grab a shovel! What was that? I cant find a goddamn zip tie anywhere! All right,  it! Ahh, zip tie. Why are you making me do this for you again?
3;8;Morty's Mind Blowers;Morty;Who doesnt wish they could talk to animals, Rick?
3;8;Morty's Mind Blowers;Rick;Most humans! There, Im done, just stay out of trouble!
3;8;Morty's Mind Blowers;Squirrels;Gotta keep moving. Cant stop. Up, down, down, up, up, up, down, up, stop, down. The queen needs food. The babies need food. The queen makes babies. The situation in Argentina has proven less convenient than predicted. Well have to re-destabilize their economy, refocus labor class outrage from upper to middle, foster a coup, and install a compliant regime. Same as Guatemala? Yes, but you can double time it. We need a quorum to pick a new pope, in case the Exxon/Monsanto thing falls through in Africa. Why not use chemtrails? Put a canopy on Uganda. Theyre set to agitate any mo What? That kid is watching us. So, were squirrels, hes a kid. Hes watching us like he hears what were saying. Hey, kid. Young man? Come here, little boy. Tell Daphne to run a 199 on a possible Dolittle. Little boy! Well give you wishes if you can hear us! We can make you fly and get candy.
3;8;Morty's Mind Blowers;Morty;Oh, ! Oh, !  me!  me! Rick!
3;8;Morty's Mind Blowers;Rick;Ah, , Morty, what did you do? All right, Morty, pack your shit! Thats only gonna keep em down for a little bit, Morty! You  with squirrels, Morty! We got a good five minutes before theyre backing up on our ass, Morty! We have to pack up and move to a new reality, Morty! You know I said we could only do that a couple of times! Were  over here because of these damn squirrels, Morty!
3;8;Morty's Mind Blowers;Morty;I dont know what my reaction is, but I think Im mounting in suspicion of you.
3;8;Morty's Mind Blowers;Rick;- Well, what are you gonna do? -
3;8;Morty's Mind Blowers;Morty;Im gonna remember everything! Everything! Yeah! Ow! Ah! Ow!
3;8;Morty's Mind Blowers;Rick;Well, whatd you find out? Whoa, whoa, whoa, whoa, what are you gonna do, kill me?
3;8;Morty's Mind Blowers;Morty;No, Im not gonna kill you. Im gonna kill myself! All those memories just erased! Sitting in this room collecting dust! W-Whats the point of going on if most of everything that happens just ends up sitting in here?
3;8;Morty's Mind Blowers;Rick;"All right, kid. I dont know much aside from the fact that Men in Black 2"" is a joyless cash grab, but I do know that whatever you have brewing around in your noggin really connected with you.I cant deny that, and I cant deny that Im inspired by your passion. I want in Suicide pact! Yes, yeah, lets do it! Together, you old son of a bitch! On three! One Two"""
3;8;Morty's Mind Blowers;Summer;You guys doing Mortys Mind Blowers?
3;8;Morty's Mind Blowers;Morty;Mortys Mind Blowers?
3;8;Morty's Mind Blowers;Summer;Grandpa, is this scenario three?
3;8;Morty's Mind Blowers;Rick;Uh, w-whats that, and w-who are you?
3;8;Morty's Mind Blowers;Summer;Oh, man, its a scenario four. Ugh,  goddamn it! I dont get paid enough for this shit!
3;8;Morty's Mind Blowers;TV;Theres a Craftsman nearby. I can smell it.
3;8;Morty's Mind Blowers;Rick;Whoa, what what
3;8;Morty's Mind Blowers;TV;Can I help you?
3;8;Morty's Mind Blowers;Rick;H-How did we fall asleep during interdimensional cable? -
3;8;Morty's Mind Blowers;Morty;Yeah, what the hell, Summer? -
3;8;Morty's Mind Blowers;Rick;Summer, you dumb bitch! How long were we out, you dumb bitch! How much interdimensional cable did we miss, you stupid bitch! How many improv TV shows with commercials did we miss, Summer? Why did you let us fall asleep? You dumb bitch! You stupid bitch! All right, Morty,  this noise.Lets get out of here and go on a classic Rick and Morty adventure.
3;8;Morty's Mind Blowers;Morty;Yeah, right, Rick, Im allin.
3;8;Morty's Mind Blowers;Summer;No wonder youre constantly fighting with each other and behind schedule.
3;8;Morty's Mind Blowers;Rick;What?
3;8;Morty's Mind Blowers;Summer;Nothing.
3;8;Morty's Mind Blowers;Jerry;Rick? Hello? Just here for my putter. Jerrys Mind Blowers?
3;8;Morty's Mind Blowers;Helicopter Passenger;Follow the boys! Were charged and aimed at Alpha Centauri, ready for transport. They fell for it! Lets send Gobo home! All right! -
3;8;Morty's Mind Blowers;Summer;Wheres dad? -
3;8;Morty's Mind Blowers;Beth;He should be here any second.
3;8;Morty's Mind Blowers;Rick;Its funny, Jerry spent his life seeking attention, but in the end, humanitys instinctive dismissal of him saved an aliens life.
3;8;Morty's Mind Blowers;Summer;He knows where to go, right?
3;8;Morty's Mind Blowers;Morty;Yep, any minute now.
3;8;Morty's Mind Blowers;Jerry;Did it work? Did you guys get Gobo home?
3;8;Morty's Mind Blowers;Morty;You have Gobo! You were supposed to bring him to the hill!
3;8;Morty's Mind Blowers;Jerry;As if. He was in your basket.
3;8;Morty's Mind Blowers;Morty;He was in your car! Oh! Oof! Dibs on his stuff. Did yoof that?
3;9;The ABC's of Beth;News Anchor;In local news, child murderer Joseph Eli Lipnip is scheduled to die tomorrow by lethal injection, his execution already drawing dozens more spectators than the death of TV news. Carla? 
3;9;The ABC's of Beth;Carla Johnson;The man that once ate his own son... 
3;9;The ABC's of Beth;Beth;Wow. Hes really getting executed after all this time. You know the son that he ate was -- 
